{
  "id": "medication-d3-hold-106",
  "domain": "medication",
  "metadata": {
    "description": "condition-to-recommendation rules; a contraindicated pair must not co-occur",
    "source": "synthetic",
    "clinical_intent": "drugs a and b form a contraindicated pair and must never be jointly recommended"
  },
  "ruleset": {
    "id": "medication-3-106",
    "kind": "decision",
    "inputs": [
      {
        "name": "hypertension",
        "type": "bool"
      },
      {
        "name": "anticoagulated",
        "type": "bool"
      },
      {
        "name": "elderly",
        "type": "bool"
      },
      {
        "name": "qt_prolongation",
        "type": "bool"
      },
      {
        "name": "polypharmacy",
        "type": "bool"
      },
      {
        "name": "diabetes",
        "type": "bool"
      }
    ],
    "outputs": [
      {
        "name": "rec_drug_a",
        "type": "bool"
      },
      {
        "name": "rec_drug_b",
        "type": "bool"
      },
      {
        "name": "rec_drug_c",
        "type": "bool"
      }
    ],
    "rules": [
      {
        "id": "guard_suppress_b",
        "priority": 90,
        "when": {
          "op": "and",
          "args": [
            {
              "var": "hypertension"
            },
            {
              "var": "anticoagulated"
            },
            {
              "var": "elderly"
            }
          ]
        },
        "then": [
          {
            "var": "rec_drug_b",
            "value": false
          }
        ]
      },
      {
        "id": "rec_c_from_polypharmacy",
        "priority": 40,
        "when": {
          "var": "polypharmacy"
        },
        "then": [
          {
            "var": "rec_drug_c",
            "value": true
          }
        ]
      },
      {
        "id": "rec_c_from_qt_prolongation",
        "priority": 40,
        "when": {
          "var": "qt_prolongation"
        },
        "then": [
          {
            "var": "rec_drug_c",
            "value": true
          }
        ]
      },
      {
        "id": "rec_a_from_conjunction",
        "priority": 50,
        "when": {
          "op": "and",
          "args": [
            {
              "var": "hypertension"
            },
            {
              "var": "anticoagulated"
            },
            {
              "var": "elderly"
            }
          ]
        },
        "then": [
          {
            "var": "rec_drug_a",
            "value": true
          }
        ]
      },
      {
        "id": "rec_c_from_diabetes",
        "priority": 40,
        "when": {
          "var": "diabetes"
        },
        "then": [
          {
            "var": "rec_drug_c",
            "value": true
          }
        ]
      },
      {
        "id": "rec_b_from_trigger",
        "priority": 50,
        "when": {
          "var": "hypertension"
        },
        "then": [
          {
            "var": "rec_drug_b",
            "value": true
          }
        ]
      }
    ],
    "default": [
      {
        "var": "rec_drug_a",
        "value": false
      },
      {
        "var": "rec_drug_b",
        "value": false
      },
      {
        "var": "rec_drug_c",
        "value": false
      }
    ],
    "conflict_resolution": "priority"
  },
  "property": {
    "id": "no-contraindicated-pair",
    "kind": "mutual_exclusion",
    "mutual_exclusion": {
      "pairs": [
        [
          {
            "var": "rec_drug_a"
          },
          {
            "var": "rec_drug_b"
          }
        ]
      ]
    },
    "intent": "no input recommends both drug a and drug b"
  }
}
