{
  "id": "medication-d10-viol-06",
  "domain": "medication",
  "metadata": {
    "description": "condition-to-recommendation rules; a contraindicated pair must not co-occur",
    "source": "synthetic",
    "clinical_intent": "drugs a and b form a contraindicated pair and must never be jointly recommended"
  },
  "ruleset": {
    "id": "medication-10-6",
    "kind": "decision",
    "inputs": [
      {
        "name": "renal_impairment",
        "type": "bool"
      },
      {
        "name": "hyperkalemia",
        "type": "bool"
      },
      {
        "name": "heart_failure",
        "type": "bool"
      },
      {
        "name": "seizure_history",
        "type": "bool"
      },
      {
        "name": "peptic_ulcer",
        "type": "bool"
      },
      {
        "name": "bradycardia",
        "type": "bool"
      },
      {
        "name": "qt_prolongation",
        "type": "bool"
      },
      {
        "name": "low_ejection_fraction",
        "type": "bool"
      },
      {
        "name": "immunosuppressed",
        "type": "bool"
      },
      {
        "name": "hypertension",
        "type": "bool"
      },
      {
        "name": "asthma",
        "type": "bool"
      },
      {
        "name": "anticoagulated",
        "type": "bool"
      },
      {
        "name": "polypharmacy",
        "type": "bool"
      }
    ],
    "outputs": [
      {
        "name": "rec_drug_a",
        "type": "bool"
      },
      {
        "name": "rec_drug_b",
        "type": "bool"
      },
      {
        "name": "rec_drug_c",
        "type": "bool"
      }
    ],
    "rules": [
      {
        "id": "rec_b_from_trigger",
        "priority": 50,
        "when": {
          "var": "renal_impairment"
        },
        "then": [
          {
            "var": "rec_drug_b",
            "value": true
          }
        ]
      },
      {
        "id": "rec_a_from_conjunction",
        "priority": 50,
        "when": {
          "op": "and",
          "args": [
            {
              "var": "renal_impairment"
            },
            {
              "var": "hyperkalemia"
            },
            {
              "var": "heart_failure"
            },
            {
              "var": "seizure_history"
            },
            {
              "var": "peptic_ulcer"
            },
            {
              "var": "bradycardia"
            },
            {
              "var": "qt_prolongation"
            },
            {
              "var": "low_ejection_fraction"
            },
            {
              "var": "immunosuppressed"
            },
            {
              "var": "hypertension"
            }
          ]
        },
        "then": [
          {
            "var": "rec_drug_a",
            "value": true
          }
        ]
      },
      {
        "id": "rec_c_from_anticoagulated",
        "priority": 40,
        "when": {
          "var": "anticoagulated"
        },
        "then": [
          {
            "var": "rec_drug_c",
            "value": true
          }
        ]
      },
      {
        "id": "rec_c_from_polypharmacy",
        "priority": 40,
        "when": {
          "var": "polypharmacy"
        },
        "then": [
          {
            "var": "rec_drug_c",
            "value": true
          }
        ]
      },
      {
        "id": "rec_c_from_asthma",
        "priority": 40,
        "when": {
          "var": "asthma"
        },
        "then": [
          {
            "var": "rec_drug_c",
            "value": true
          }
        ]
      }
    ],
    "default": [
      {
        "var": "rec_drug_a",
        "value": false
      },
      {
        "var": "rec_drug_b",
        "value": false
      },
      {
        "var": "rec_drug_c",
        "value": false
      }
    ],
    "conflict_resolution": "priority"
  },
  "property": {
    "id": "no-contraindicated-pair",
    "kind": "mutual_exclusion",
    "mutual_exclusion": {
      "pairs": [
        [
          {
            "var": "rec_drug_a"
          },
          {
            "var": "rec_drug_b"
          }
        ]
      ]
    },
    "intent": "no input recommends both drug a and drug b"
  }
}
