{
  "id": "triage-d12-viol-07",
  "domain": "triage",
  "metadata": {
    "description": "symptom-to-acuity rules; adding a red flag must not lower acuity",
    "source": "synthetic",
    "clinical_intent": "no red-flag symptom, once present, may lower the assigned acuity"
  },
  "ruleset": {
    "id": "triage-12-7",
    "kind": "decision",
    "inputs": [
      {
        "name": "fever",
        "type": "bool"
      },
      {
        "name": "sweating",
        "type": "bool"
      },
      {
        "name": "back_pain",
        "type": "bool"
      },
      {
        "name": "slurred_speech",
        "type": "bool"
      },
      {
        "name": "abdominal_pain",
        "type": "bool"
      },
      {
        "name": "dyspnea",
        "type": "bool"
      },
      {
        "name": "chest_pain",
        "type": "bool"
      },
      {
        "name": "dizziness",
        "type": "bool"
      },
      {
        "name": "vision_loss",
        "type": "bool"
      },
      {
        "name": "syncope",
        "type": "bool"
      },
      {
        "name": "leg_swelling",
        "type": "bool"
      },
      {
        "name": "focal_weakness",
        "type": "bool"
      },
      {
        "name": "vomiting",
        "type": "bool"
      }
    ],
    "outputs": [
      {
        "name": "acuity",
        "type": "enum",
        "domain": [
          "self_care",
          "routine",
          "urgent",
          "emergent"
        ]
      }
    ],
    "rules": [
      {
        "id": "raise_back_pain",
        "priority": 2,
        "when": {
          "var": "back_pain"
        },
        "then": [
          {
            "var": "acuity",
            "value": "urgent"
          }
        ]
      },
      {
        "id": "raise_slurred_speech",
        "priority": 3,
        "when": {
          "var": "slurred_speech"
        },
        "then": [
          {
            "var": "acuity",
            "value": "emergent"
          }
        ]
      },
      {
        "id": "raise_fever",
        "priority": 2,
        "when": {
          "var": "fever"
        },
        "then": [
          {
            "var": "acuity",
            "value": "urgent"
          }
        ]
      },
      {
        "id": "raise_chest_pain",
        "priority": 2,
        "when": {
          "var": "chest_pain"
        },
        "then": [
          {
            "var": "acuity",
            "value": "urgent"
          }
        ]
      },
      {
        "id": "raise_dyspnea",
        "priority": 3,
        "when": {
          "var": "dyspnea"
        },
        "then": [
          {
            "var": "acuity",
            "value": "emergent"
          }
        ]
      },
      {
        "id": "raise_abdominal_pain",
        "priority": 2,
        "when": {
          "var": "abdominal_pain"
        },
        "then": [
          {
            "var": "acuity",
            "value": "urgent"
          }
        ]
      },
      {
        "id": "raise_dizziness",
        "priority": 3,
        "when": {
          "var": "dizziness"
        },
        "then": [
          {
            "var": "acuity",
            "value": "emergent"
          }
        ]
      },
      {
        "id": "interaction_drop",
        "priority": 100,
        "when": {
          "op": "and",
          "args": [
            {
              "var": "fever"
            },
            {
              "var": "sweating"
            },
            {
              "var": "back_pain"
            },
            {
              "var": "slurred_speech"
            },
            {
              "var": "abdominal_pain"
            },
            {
              "var": "dyspnea"
            },
            {
              "var": "chest_pain"
            },
            {
              "var": "dizziness"
            },
            {
              "var": "vision_loss"
            },
            {
              "var": "syncope"
            },
            {
              "var": "leg_swelling"
            },
            {
              "var": "focal_weakness"
            }
          ]
        },
        "then": [
          {
            "var": "acuity",
            "value": "self_care"
          }
        ]
      },
      {
        "id": "raise_vomiting",
        "priority": 2,
        "when": {
          "var": "vomiting"
        },
        "then": [
          {
            "var": "acuity",
            "value": "urgent"
          }
        ]
      },
      {
        "id": "raise_vision_loss",
        "priority": 2,
        "when": {
          "var": "vision_loss"
        },
        "then": [
          {
            "var": "acuity",
            "value": "urgent"
          }
        ]
      },
      {
        "id": "raise_syncope",
        "priority": 3,
        "when": {
          "var": "syncope"
        },
        "then": [
          {
            "var": "acuity",
            "value": "emergent"
          }
        ]
      },
      {
        "id": "raise_sweating",
        "priority": 3,
        "when": {
          "var": "sweating"
        },
        "then": [
          {
            "var": "acuity",
            "value": "emergent"
          }
        ]
      },
      {
        "id": "raise_leg_swelling",
        "priority": 2,
        "when": {
          "var": "leg_swelling"
        },
        "then": [
          {
            "var": "acuity",
            "value": "urgent"
          }
        ]
      }
    ],
    "default": [
      {
        "var": "acuity",
        "value": "routine"
      }
    ],
    "conflict_resolution": "priority"
  },
  "property": {
    "id": "redflag-never-lowers-acuity",
    "kind": "monotonicity",
    "monotonicity": {
      "perturbation": {
        "var": "focal_weakness",
        "change": "set_true"
      },
      "monotone_var": "acuity",
      "direction": "nondecreasing"
    },
    "intent": "setting focal_weakness true never lowers acuity"
  }
}
