{
  "id": "triage-d8-hold-106",
  "domain": "triage",
  "metadata": {
    "description": "symptom-to-acuity rules; adding a red flag must not lower acuity",
    "source": "synthetic",
    "clinical_intent": "no red-flag symptom, once present, may lower the assigned acuity"
  },
  "ruleset": {
    "id": "triage-8-106",
    "kind": "decision",
    "inputs": [
      {
        "name": "leg_swelling",
        "type": "bool"
      },
      {
        "name": "fever",
        "type": "bool"
      },
      {
        "name": "syncope",
        "type": "bool"
      },
      {
        "name": "abdominal_pain",
        "type": "bool"
      },
      {
        "name": "vision_loss",
        "type": "bool"
      },
      {
        "name": "focal_weakness",
        "type": "bool"
      },
      {
        "name": "vomiting",
        "type": "bool"
      },
      {
        "name": "dizziness",
        "type": "bool"
      },
      {
        "name": "sweating",
        "type": "bool"
      }
    ],
    "outputs": [
      {
        "name": "acuity",
        "type": "enum",
        "domain": [
          "self_care",
          "routine",
          "urgent",
          "emergent"
        ]
      }
    ],
    "rules": [
      {
        "id": "raise_fever",
        "priority": 3,
        "when": {
          "var": "fever"
        },
        "then": [
          {
            "var": "acuity",
            "value": "emergent"
          }
        ]
      },
      {
        "id": "raise_syncope",
        "priority": 2,
        "when": {
          "var": "syncope"
        },
        "then": [
          {
            "var": "acuity",
            "value": "urgent"
          }
        ]
      },
      {
        "id": "raise_sweating",
        "priority": 3,
        "when": {
          "var": "sweating"
        },
        "then": [
          {
            "var": "acuity",
            "value": "emergent"
          }
        ]
      },
      {
        "id": "raise_vision_loss",
        "priority": 2,
        "when": {
          "var": "vision_loss"
        },
        "then": [
          {
            "var": "acuity",
            "value": "urgent"
          }
        ]
      },
      {
        "id": "raise_leg_swelling",
        "priority": 2,
        "when": {
          "var": "leg_swelling"
        },
        "then": [
          {
            "var": "acuity",
            "value": "urgent"
          }
        ]
      },
      {
        "id": "raise_focal_weakness",
        "priority": 3,
        "when": {
          "var": "focal_weakness"
        },
        "then": [
          {
            "var": "acuity",
            "value": "emergent"
          }
        ]
      },
      {
        "id": "raise_abdominal_pain",
        "priority": 3,
        "when": {
          "var": "abdominal_pain"
        },
        "then": [
          {
            "var": "acuity",
            "value": "emergent"
          }
        ]
      },
      {
        "id": "raise_vomiting",
        "priority": 2,
        "when": {
          "var": "vomiting"
        },
        "then": [
          {
            "var": "acuity",
            "value": "urgent"
          }
        ]
      }
    ],
    "default": [
      {
        "var": "acuity",
        "value": "routine"
      }
    ],
    "conflict_resolution": "priority"
  },
  "property": {
    "id": "redflag-never-lowers-acuity",
    "kind": "monotonicity",
    "monotonicity": {
      "perturbation": {
        "var": "dizziness",
        "change": "set_true"
      },
      "monotone_var": "acuity",
      "direction": "nondecreasing"
    },
    "intent": "setting dizziness true never lowers acuity"
  }
}
