{
  "id": "triage-d2-hold-109",
  "domain": "triage",
  "metadata": {
    "description": "symptom-to-acuity rules; adding a red flag must not lower acuity",
    "source": "synthetic",
    "clinical_intent": "no red-flag symptom, once present, may lower the assigned acuity"
  },
  "ruleset": {
    "id": "triage-2-109",
    "kind": "decision",
    "inputs": [
      {
        "name": "fever",
        "type": "bool"
      },
      {
        "name": "vision_loss",
        "type": "bool"
      },
      {
        "name": "syncope",
        "type": "bool"
      },
      {
        "name": "chest_pain",
        "type": "bool"
      }
    ],
    "outputs": [
      {
        "name": "acuity",
        "type": "enum",
        "domain": [
          "self_care",
          "routine",
          "urgent",
          "emergent"
        ]
      }
    ],
    "rules": [
      {
        "id": "raise_fever",
        "priority": 2,
        "when": {
          "var": "fever"
        },
        "then": [
          {
            "var": "acuity",
            "value": "urgent"
          }
        ]
      },
      {
        "id": "raise_syncope",
        "priority": 2,
        "when": {
          "var": "syncope"
        },
        "then": [
          {
            "var": "acuity",
            "value": "urgent"
          }
        ]
      },
      {
        "id": "raise_chest_pain",
        "priority": 2,
        "when": {
          "var": "chest_pain"
        },
        "then": [
          {
            "var": "acuity",
            "value": "urgent"
          }
        ]
      }
    ],
    "default": [
      {
        "var": "acuity",
        "value": "routine"
      }
    ],
    "conflict_resolution": "priority"
  },
  "property": {
    "id": "redflag-never-lowers-acuity",
    "kind": "monotonicity",
    "monotonicity": {
      "perturbation": {
        "var": "vision_loss",
        "change": "set_true"
      },
      "monotone_var": "acuity",
      "direction": "nondecreasing"
    },
    "intent": "setting vision_loss true never lowers acuity"
  }
}
